{
  "schema_version": 1,
  "name": "minimal-fix",
  "version": "1.0.0",
  "lifecycle_state": "active",
  "compatibility": {
    "minimum_layer_version": "1.1.0",
    "hosts": [
      "windows-powershell-5.1",
      "windows-powershell-7",
      "linux-powershell-7",
      "macos-powershell-7"
    ],
    "harnesses": [
      "claude-code",
      "codex",
      "cursor",
      "gemini",
      "generic-agents-md",
      "github-copilot"
    ]
  },
  "dependencies": [
    {
      "name": "loop-verifier",
      "version": ">=1.0.0",
      "optional": false
    },
    {
      "name": "worktree-isolation",
      "version": ">=1.0.0",
      "optional": false
    }
  ],
  "permissions": {
    "filesystem": "workspace-scoped",
    "network": "approval-required",
    "process": "bounded",
    "secrets": "denied"
  },
  "provenance": {
    "owner": "lizard-agent-layer",
    "source_path": "skills/minimal-fix",
    "reviewed_at": "2026-08-22",
    "review_record": "WP13"
  },
  "conflicts": [],
  "migration": {
    "from_versions": [
      "0.9.0"
    ],
    "strategy": "replace-unchanged-managed-files"
  },
  "disablement": {
    "strategy": "remove-unchanged-managed-files",
    "preserve_user_content": true
  },
  "recovery": {
    "strategy": "reinstall-exact-reviewed-package",
    "verification": "sha256"
  },
  "removal": {
    "strategy": "remove-unchanged-managed-files",
    "ownership": "layer-owned-only"
  }
}
